Rank,Author,Title,Citations,Year,Publisher,Venue,Source,cit/year
89,"Morimoto, H Ohtsuka, T Sakaki, M Kawaguchi",Postlaminectomy cervical spinal cord compression demonstrated by dynamic magnetic resonance imaging: case report,39,1998, thejns.org, Journal of neurosurgery,https://thejns.org/view/journals/j-neurosurg/88/1/article-p155.xml,1
77," Kaza, M Gulati, JD Wig…",Evaluation of gall bladder carcinoma with dynamic magnetic resonance imaging and magnetic resonance cholangiopancreatography,35,2006, Wiley Online Library, Australasian …,https://onlinelibrary.wiley.com/doi/abs/10.1111/j.1440-1673.2006.01564.x,2
36,"Baba, Y Yamashita, M Onomichi…",Dynamic magnetic resonance imaging of head and neck lesions,33,1999, journals.lww.com, … Magnetic Resonance …,https://journals.lww.com/topicsinmri/abstract/1999/04000/Dynamic_Magnetic_Resonance_Imaging_of_Head_and.5.aspx,1
72,"Alper, ATP Kurt, Y Aydin, M Ozgokce…",The role of dynamic magnetic resonance imaging in the evaluation of pulmonary nodules and masses,30,2012, karger.com, Medical Principles and …,https://karger.com/mpp/article-abstract/22/1/80/203296,2
50,"Gupta, N Khandelwal, SN Mathuria…",Dynamic magnetic resonance imaging evaluation of craniovertebral junction abnormalities,30,2007, journals.lww.com, Journal of computer …,https://journals.lww.com/jcat/fulltext/2007/05000/Injuries_Involving_the_Transverse_Atlantal.00005.aspx,2
90,"Gabl, M Lener, S Pechlaner, W Judmaier",The role of dynamic magnetic resonance imaging in the detection of lesions of the ulnocarpal complex,29,1996, Elsevier, The Journal of Hand Surgery …,https://www.sciencedirect.com/science/article/pii/S0266768105801913,1
83,"Schlamann, L Reischke, D Klassen, S Maderwald…",Dynamic magnetic resonance imaging of the cervical spine using the NeuroSwing System,23,2007, journals.lww.com, Spine,https://journals.lww.com/spinejournal/fulltext/2007/10010/Dynamic_Magnetic_Resonance_Imaging_of_the_Cervical.20.aspx,1
